Finnish;English;hungarian
Pihan roskikset ovat täynnä.;The yard's garbage bins are full.;Tele a szemét az udvaron.
Talon pihalla on tosi liukasta.;It's really slippery at the house's yard.;Nagyon csúszós az udvaron.
Rappukäytävässä on savua.;There's smoke in the stairwell.;Füst van a lépcsőházban.
Hissi on jumissa.;The elevator is stuck.;A lift elakadt.
Rappukäytävän valo on rikki.;The stairwell light is broken.;Elromlott a lámpa a lépcsőházban.
Naapurista kuuluu melua yöllä.;Noise comes from the neighbors at night.;Éjszaka zaj van a szomszédból.
Naapurini soittaa kovaa musiikkia.;My neighbor plays loud music.;A szomszédom hangosan zenél.
Naapurit häiritsevät meitä yöllä.;The neighbors are disturbing us at night.;Éjszaka a szomszédok zavarnak minket.
Naapurin koira ulvoo koko ajan.;The neighbor's dog howls all the time.;A szomszéd kutyája folyton üvölt.
Avaimeni on kadonnut.;My key has disappeared.;Elveszett a kulcsom.
Unohdin avaimeni kotiin.;I forgot my key at home.;Otthon felejtettem a kulcsaimat.
Ikkunat huurtuvat.;The windows fog up.;Az ablakok bepárásodnak.
Ikkunoiden sisäpinta huurtuu.;The inside of the windows fogs up.;Az ablakok belseje bepárásodik.
Ikkunat jäätyvät.;The windows freeze.;Az ablakok lefagynak.
Ikkuna ei sulkeudu kunnolla.;The window won't close properly.;Az ablak nem zár megfelelően.
Ikkuna on jumissa.;The window is stuck.;Az ablak beragadt.
Ikkunoista vetää.;The windows are drafty.;Kihúzás az ablakokból.
Ikkunan tiiviste on homeessa.;The window seal is moldy.;Az ablaktömítés penészes.
Ikkuna on rikkoutunut.;The window is broken.;Be van törve az ablak.
Ikkunassa on halkeama.;There's a crack in the window.;Repedés van az ablakon.
Ovikello on rikki.;The doorbell is broken.;Az ajtócsengő eltört.
Ovi ei sulkeudu kunnolla.;The door won't close properly.;Az ajtó nem zár megfelelően.
Ulko-ovi ei sulkeudu kunnolla.;The front door won't close properly.;A külső ajtó nem zár megfelelően.
Ulko-ovi ei mene lukkoon.;The front door doesn't lock.;A bejárati ajtó nem záródik be.
Asunnon ovi jumittaa.;The door is sticking.;A lakás ajtaja beszorult.
Ovi narisee.;The door creaks.;Az ajtó nyikorog.
Oven lukko on jumissa.;The door lock is stuck.;Az ajtózár beragadt.
Oven lukko on jäässä.;The door lock is frozen.;Az ajtózár befagyott.
Oven kahva jäi käteen.;The door handle fell off.;Az ajtókilincs beszorult a kézbe.
Asunnon katto vuotaa.;The apartment's ceiling leaks.;A lakás teteje szivárog.
Talon katto vuotaa.;The house's roof leaks.;A ház teteje szivárog.
Katosta tippuu vettä.;Water drips from the ceiling.;A mennyezetről csöpög a víz.
Asunnon seinät ovat märkänä.;The walls of the apartment are wet.;A lakás falai vizesek.
Asunnon seinät ovat epätasaisia.;The walls of the apartment are uneven.;A lakás falai egyenetlenek.
Seinät ovat liian ohuet.;The walls are too thin.;A falak túl vékonyak.
Seinässä on halkeama.;There is a crack in the wall.;Repedés van a falon.
Seinässä rapisee.;There's a scratching inside the wall.;Rohad a fal.
Seinälaatat irtoilevat.;The wall tiles are coming loose.;Lejönnek a fali csempék.
Asunnossa on liian kuuma.;It's too hot in the apartment.;Túl meleg van a lakásban.
Asunnossa on liian kylmä.;It's too cold in the apartment.;Túl hideg van a lakásban.
Lämpöpatteri lorisee.;The radiator rattles.;A radiátor lemerül.
Lämpöpatteri suhisee.;The radiator hisses.;A radiátor süvít.
Patteri vuotaa.;The radiator is leaking.;Az akkumulátor szivárog.
Patterit tuntuvat kylmiltä.;The radiators feel cold.;A radiátorok hidegnek tűnnek.
Patteri ei lämpene.;The radiator won't heat.;Az akkumulátor nem melegszik fel.
Sähköt menivät poikki.;The electricity stopped working.;Elment az áram.
Sähköt eivät toimi.;The electricity doesn't work.;Az áram nem működik.
Asunnosta on sähköt poikki.;There is no electricity in the apartment.;Az áram nincs a lakásban.
Sähköt pimenivät koko talosta.;The electricity went dark in the whole house.;Az egész házban elment az áram.
Sähköt on kateissa osassa taloa.;The electricity doesn't work in part of the house.;A ház egy részében nincs áram.
Pistoke on hajonnut.;The plug is broken.;A dugó eltört.
Sähköjohto on rikki.;The power cord is broken.;A tápkábel megszakadt.
Vesihana vuotaa.;The faucet is leaking.;A csap szivárog.
Vesihanasta ei tule vettä.;No water comes from the tap.;Nem jön ki víz a csapból.
Vesihanan tiiviste pitää vaihtaa.;The tap gasket needs to be changed.;A vízcsap tömítését ki kell cserélni.
Vesihana ei sulkeudu kokonaan.;The tap won't close all the way.;A vízcsap nem zár el teljesen.
Vettä virtaa vain vähän.;Water flows only a little.;Csak egy kevés víz folyik.
Hanasta tulee vain kylmää vettä.;Only cold water comes from the tap.;Csak hideg víz jön ki a csapból.
Pesuallas vuotaa.;The sink is leaking.;A mosogató szivárog.
Pesuallas on tukossa.;The sink is clogged.;A mosogató eltömődött.
Pesualtaan viemäri on tukossa.;The sink drain is blocked.;A mosogató lefolyója el van dugulva.
Viemäri on tukossa.;The drain is clogged.;A lefolyó eltömődött.
Viemäri ei vedä.;The drain doesn't pull.;A lefolyó nem folyik le.
Suihkun hana tiputtaa.;The shower tap drips.;Csöpög a zuhany csaptelep.
Suihku tiputtaa vettä suihkun jälkeen.;The shower keeps dripping after usage.;A zuhany zuhanyozás után csöpög a víz.
Suihkun veden lämpötila vaihtelee.;The shower water temp varies.;A zuhanyvíz hőmérséklete változó.
Suihkuletku vuotaa.;The shower hose is leaking.;A zuhanycső szivárog.
Suihkun viemäri on tukossa.;The shower drain is clogged.;A zuhany lefolyója el van dugulva.
WC on rikki. Vessa on rikki.;The toilet is broken.;A WC elromlott. A WC elromlott.
Vessanpönttö vuotaa vettä.;The toilet bowl is leaking water.;A WC csészéből szivárog a víz.
Vessanpönttö lorisee.;The toilet gurgles.;A vécé öblít.
Vessanpönttö on haljennut.;The toilet bowl has cracked.;A wc csésze megrepedt.
Vessa vetää koko ajan.;The toilet keeps running.;A vécé állandóan öblít.
Vettä valuu pyttyyn koko ajan.;Water keeps running in the toilet all the time.;A víz folyamatosan folyik a tócsába.
Asunnossa on homeen hajua.;There's a moldy smell in the apartment.;A lakásban penészszag van.
Laattasaumoissa on hometta.;There mold in the tile seams.;A csempe illesztéseiben penész található.
Katossa on hometta.;There's mold on the ceiling.;A mennyezeten penész van.
Kylpyhuoneessa on hometta.;There's mold in the bathroom.;A fürdőszobában penész van.
Kylpyhuoneessa on kosteusvaurio.;The bathroom has moisture damage.;A fürdőszobában nedvességkár keletkezett.
Asunnossa haisee.;The apartment smells.;A lakás illatos.
Asunnossa on viemärinhaju.;There's a sewage smell in the apartment.;Csatorna szaga van a lakásban.
Asunnossa on outo haju.;There's a weird smell in the apartment.;Furcsa szag van a lakásban.
Hajut eivät poistu asunnosta.;Odors won't leave the apartment.;A szagok nem hagyják el a lakást.
Paistokäryt eivät poistu asunnosta.;Cooking smells won't clear up.;A sütőkocsik nem hagyják el a lakást.
Paistokäryt leviävät koko asuntoon.;Cooking smells spread through the apartment.;A sütőkocsik szétterültek az egész lakásban.
Huoneilma on tunkkaista.;The room air is stuffy.;A szoba levegője fülledt.
Ilmanvaihto ei toimi normaalisti.;Ventilation doesn't work properly.;A szellőztetés nem működik megfelelően.
Ilma ei vaihdu riittävästi.;The air doesn't circulate enough.;A levegő nem változik kellőképpen.
Porraskäytävästä tulee hajuja.;There are odors coming form the stairwell.;A lépcsőházból szagok áradnak.
Rappukäytävässä haisee.;It stinks in the stairwell.;A lépcsőház szaga van.
Ilmastointikanavista tippuu vettä.;Water drips from the ventilation ducts.;Víz csöpög a légkondicionáló csatornáiból.
Asunnossa on huono sisäilma.;The apartment has poor indoor air.;A lakásban rossz a belső levegő.
Vaatekaapissa on turkiskuoriaisia.;There are fur beetles in the wardrobe.;A gardróbban szőrbogarak vannak.
Asunnossa on lutikoita.;There are bedbugs in the apartment.;Poloskák vannak a lakásban.
Talossa on torakoita.;There are cockroaches in the house.;Csótányok vannak a házban.
Asunnossa vilisee koiperhosia.;There are lots of moths in the apartment.;A lakásban molyok zümmögnek.
Talossa on hiiriä.;There are mice in the building.;Egerek vannak a házban.
Näin rotan asunnossa.;I saw a rat in the apartment.;Láttam egy patkányt a lakásban.
Keittiössä on banaanikärpäsiä.;There are fruit flies in the kitchen.;A konyhában banánlegyek vannak.
Astianpesukoneeseen ei tule vettä.;The dishwasher doesn't get water.;Nincs víz a mosogatógépben.
Jääkaappi vuotaa vettä.;The refrigerator leaks.;A hűtőből szivárog a víz.
Jääkaapin alla on vettä.;There's water underneath the fridge.;Víz van a hűtő alatt.
Jääkaappi lakkasi toimimasta.;The fridge stopped working.;A hűtő leállt.
Jääkaapin sisälle keräytyy vettä.;Water builds up inside the fridge.;A víz összegyűlik a hűtőszekrény belsejében.
Jääkaapin valo ei pala.;The fridge light doesn't work.;A hűtő lámpája nem világít.
Jääkaappi pitää kovaa ääntä.;The fridge makes loud noises.;A hűtőszekrény hangos zajt ad.
Jääkaappi pitää kovaa meteliä.;The fridge is really noisy.;A hűtőszekrény nagy zajt ad.
Pakastin vuotaa.;The freezer is leaking.;A fagyasztó szivárog.
Pakastimen alla on vettä.;There's water underneath the freezer.;Víz van a fagyasztó alatt.
Pakastimen ovi ei pysy kiinni.;The freezer door won't stay shut.;A fagyasztó ajtaja nem marad zárva.
Liesi ei mene päälle.;The stove doesn't work.;A tűzhely nem kapcsol be.
Liesi ei lämpene kunnolla.;The stove won't heat properly.;A tűzhely nem melegszik fel megfelelően.
Hellan levyt eivät lämpene.;The stove plates won't heat up.;A Hella tányérjai nem melegszenek fel.
Nettiyhteys on hidas.;The internet connection is slow.;Az internetkapcsolat lassú.
Wifi ei toimi.;The wifi doesn't work.;Wifi nem működik.
Nettiyhteys ei toimi lainkaan.;The internet connection doesn't work at all.;Az internetkapcsolat egyáltalán nem működik.
