Finnish;English;Hungarian
Miten joukkueurheilu voi vaikuttaa lapsen kehitykseen?;How can team sports affect a child's development?;Hogyan befolyásolhatja a csapatsport a gyermek fejlődését?
Miten koulukiusaaminen vaikuttaa lapseen?;How does bullying at school affect a child?;Hogyan hat az iskolai zaklatás egy gyerekre?
Miten puuttuisit koulukiusaamiseen?;How would you deal with bullying at school?;Hogyan kezelnéd az iskolai bántalmazást?
Mitä lastenkirjat voivat opettaa lapselle?;What can children's books teach a child?;Mit taníthatnak a mesekönyvek egy gyereknek?
Kuinka tärkeää kirjojen lukeminen lapsille on mielestäsi?;How important do you think it is to read books to children?;Mennyire fontos szerinted könyveket olvasni a gyerekeknek?
Miten lapsen käsitys elämästä eroaa aikuisen käsityksestä?;How does a child's perception of life differ from an adult's?;Miben különbözik egy gyermek életszemlélete egy felnőttétől?
Miten lapselle / teinille voi puhua seksistä?;How can you talk to a child / teenager about sex?;Hogyan lehet egy gyerekkel / tinédzserrel a szexről beszélni?
Kuinka vanhana seksuaalikasvatus kannattaa aloittaa?;At what age should sex education start?;Milyen életkorban érdemes elkezdeni a szexuális felvilágosítást?
Miten kaksikielisyys vaikuttaa lapsen mahdollisuuksiin?;How does bilingualism affect a child's opportunities?;Hogyan befolyásolja a kétnyelvűség a gyermek lehetőségeit?
Onko lapsuus elämän parasta aikaa? Miksi?;Is childhood the best time of life? Why?;A gyerekkor az élet legjobb időszaka? Miért?
Mikä voi olla lastenkirjojen rooli lapsen arvojen kehityksessä?;What role can children's books play in the development of a child's values?;Milyen szerepet játszhatnak a gyerekkönyvek a gyermek értékrendjének kialakulásában?
Miten tärkeää on altistaa lapsia eri kulttuureihin?;How important is it to expose children to different cultures?;Mennyire lényeges a gyerekeket különböző kultúráknak kitenni?
Millaista erityistä tukea vammainen lapsi saattaa tarvita?;What kind of special support might a disabled child need?;Milyen speciális segítségre lehet szüksége egy fogyatékkal élő gyermeknek?
Miten yhteiskunta voisi tukea kehitysvammaisia lapsia paremmin?;How could society better support children with developmental disabilities?;Hogyan támogathatná jobban a társadalom a fejlődési rendellenességgel élő gyermekeket?
Miten lapsuuden käsitys eroaa eri kulttuurien välillä?;How does the concept of childhood differ between different cultures?;Miben különbözik a gyerekkor felfogása a különböző kultúrákban?
Miten sosiaalinen media vaikuttaa lapsen sosiaalisiin taitoihin?;How does social media affect a child's social skills?;Miként hat a közösségi média a gyermek társas készségeire?
Mikä on medialukutaidon merkitys nykylasten elämässä?;What is the importance of media literacy in the lives of today's children?;Milyen jelentősége van a médiatudatosságnak a mai gyerekek életében?
Mikä on elämänfilosofiasi, jota haluan välittää lapsillesi?;What is your life philosophy that I want to pass on to your children?;Mi az életfilozófiád, amit át szeretnél adni a gyermekeidnek?
Millaisia eettisiä pulmia liittyy lapsityövoiman käyttöön?;What kind of ethical dilemmas relate to the use of child labor?;Milyen erkölcsi dilemmák kapcsolódnak a gyermekmunka alkalmazásához?
Miten lasten rooli on muuttunut kautta aikojen?;How has the role of children changed over time?;Hogyan változott a gyermekek szerepe az idők folyamán?
Mikä on kurinpidon ja vapauden suhde lapsen kasvatuksessa?;What is the relationship between discipline and freedom in raising a child?;Mi a kapcsolat a fegyelem és a szabadság között a gyermeknevelésben?
Millä keinoilla yhteiskunnan pitäisi suojella lapsia?;With what means should society protect children?;Milyen eszközökkel kellene a társadalomnak megvédenie a gyerekeket?
Mikä on hallituksen rooli lasten oikeuksien varmistamisessa?;What is the government's role in ensuring children's rights?;Mi a kormány szerepe a gyermekjogok biztosításában?
Miten maailman kansainvälistyminen vaikuttaa lapsuuteen?;How does the internationalization of the world affect childhood?;Milyen hatással van a világ nemzetköziesedése a gyerekkorra?
Miten ylisuojeleminen vaikuttaa lapsen psyykeen?;How does overprotection affect a child's psyche?;Hogyan hat a túlóvás a gyermek lelki világára?
Millä tavoilla lasten asema vaikuttaa vaaleihin?;In what ways does the status of children affect elections?;Milyen módokon befolyásolja a gyerekek helyzete a választásokat?
Miten lasten asema vaikuttaa politiikkaan?;How does the position of children affect politics?;Miként befolyásolja a gyerekek státusza a politikát?
Miten lapsen kognitiiviset kyvyt kehittyvät eri vaiheissa?;How do the child's cognitive abilities develop in different stages?;Hogyan fejlődnek a gyermek kognitív képességei a különböző szakaszokban?
Miten lasten viattomuutta kuvataan kirjallisuudessa?;How is the innocence of children described in literature?;Hogyan ábrázolják a gyermekek ártatlanságát az irodalomban?
Miten lasten viattomuudesta puhutaan mediassa?;How is the innocence of children talked about in the media?;Miként emlegetik a gyermekek ártatlanságát a médiában?
Miten teknologian kehitys vaikuttaa lasten tulevaisuudennäkymiin?;How does the development of technology affect children's future prospects?;Hogyan hat a technológia fejlődése a gyermekek jövőbeli kilátásaira?
Mitä eettisiä kysymyksiä liittyy sikiön geneettiseen taustaukseen?;What ethical issues are related to the genetic background of the fetus?;Milyen etikai kérdések kapcsolódnak a magzat genetikai hátterének vizsgálatához?
Mikä eettinen pulma liittyy geneettisiin muunnelmiin?;What is the ethical dilemma associated with genetic modifications?;Milyen erkölcsi probléma kapcsolódik a genetikai módosításokhoz?
Miten nykylapsia kuvaillaan sosiaalisessa mediassa?;How are today's children described on social media?;Hogyan jellemzik a mai gyerekeket a közösségi médiában?
Miten käsitys lapsuudesta on muuttunut kautta aikojen?;How has the perception of childhood changed over time?;Miként változott a gyerekkorról alkotott kép az idők során?
Miten vanhempien sosiaalinen asema vaikuttaa lapsen elämään?;How does the parents' social status affect the child's life?;Milyen hatással van a szülők társadalmi helyzete a gyermek életére?
Miten vanhempien varallisuus vaikuttaa lapsen mahdollisuuksiin?;How does the parents' wealth affect the child's opportunities?;Hogyan befolyásolja a szülők anyagi helyzete a gyermek lehetőségeit?
Millaisia kasvatusmalleja on olemassa?;What kinds of education models are there?;Milyen nevelési modellek léteznek?
Miten monikulttuurisuus vaikuttaa lapsen identiteettiin?;How does multiculturalism affect a child's identity?;Miként befolyásolja a multikulturalizmus a gyermek identitását?
Millä tavoilla hallituksen päätökset vaikuttavat lapsuuteen?;In what ways do government decisions affect childhood?;Milyen módokon hatnak a kormány döntései a gyerekkorra?
Mikä on yhteiskunnan rooli lasten kasvatuksessa?;What is the role of society in raising children?;Mi a társadalom szerepe a gyermeknevelésben?
Miten globaalit muutokset vaikuttavat lasten koulutukseen?;How do global changes affect children's education?;Hogyan befolyásolják a globális változások a gyermekek oktatását?
Mitä tarkoitetaan käsitteellä "luonto vastaan kasvatus"?;What is meant by the term "nature versus nurture"?;Mit jelent a „veleszületett adottság kontra nevelés" kifejezés?
Miten maan sosioekonominen tilanne vaikuttaa lapsen elämään?;How does the socio-economic situation of a country affect a child's life?;Miként hat egy ország társadalmi-gazdasági helyzete a gyermek életére?
Miten ilmastonmuutos vaikuttaa lasten tulevaisuuteen?;How does climate change affect children's future?;Hogyan hat a klímaváltozás a gyerekek jövőjére?
Miten lapsia voi / täytyy tukea traumojen käsittelyssä?;How can / should children be supported in dealing with trauma?;Hogyan lehet / kell támogatni a gyerekeket a traumák feldolgozásában?
Miten lapsuusajan traumat vaikuttavat lapsen elämään aikuisena?;How do childhood traumas affect a child's life as an adult?;Milyen hatással vannak a gyermekkori traumák a felnőttkori életre?